{"$schema":"https://json-schema.org/draft/2020-12/schema","type":"object","required":["source_name","url","type","specialty","trust_level","last_checked_at","access_status","notes","hash"],"properties":{"source_name":{"type":"string"},"url":{"type":"string","format":"uri"},"type":{"type":"string"},"specialty":{"type":"string"},"trust_level":{"type":"string"},"last_checked_at":{"type":["string","null"]},"access_status":{"type":"string"},"notes":{"type":"string"},"hash":{"type":"object"}}}
